García-Guillén R.M.; De Silva-Dávila R.; Silva-Segundo C.A.; Domínguez-Contreras J.F.; Carrillo L.; Vásquez-Yeomans L.	2023	Article	NA	Bulletin of Marine Science	English	García-Guillén R.M. Universidad Autónoma de Baja California Sur Carretera al sur. KM. 5.5 BCS La Paz 23080 Mexico; De Silva-Dávila R. Instituto Politécnico Nacional Centro Interdisciplinario de Ciencias Marinas Av IPN s/n Col Playa Palo de Sta. Rita BCS La Paz 23096 Mexico; Silva-Segundo C.A. Instituto Politécnico Nacional Centro Interdisciplinario de Ciencias Marinas Av IPN s/n Col Playa Palo de Sta. Rita BCS La Paz 23096 Mexico Universidad Autónoma de Baja California Sur Departamento de Ingeniería Pesquera Carretera al sur. KM. 5.5 BCS La Paz 23080 Mexico; Domínguez-Contreras J.F. Instituto Politécnico Nacional Centro Interdisciplinario de Ciencias Marinas Av IPN s/n Col Playa Palo de Sta. Rita BCS La Paz 23096 Mexico; Carrillo L. El Colegio de la Frontera Sur Unidad Chetumal Av del Centenario Km. 5.5 Q. Roo Chetumal 77014 Mexico; Vásquez-Yeomans L. El Colegio de la Frontera Sur Unidad Chetumal Av del Centenario Km. 5.5 Q. Roo Chetumal 77014 Mexico	Universidad Autónoma de Baja California Sur Carretera al sur. KM. 5.5 BCS La Paz 23080 Mexico; Instituto Politécnico Nacional Centro Interdisciplinario de Ciencias Marinas Av IPN s/n Col Playa Palo de Sta. Rita BCS La Paz 23096 Mexico; Universidad Autónoma de Baja California Sur Departamento de Ingeniería Pesquera Carretera al sur. KM. 5.5 BCS La Paz 23080 Mexico; El Colegio de la Frontera Sur Unidad Chetumal Av del Centenario Km. 5.5 Q. Roo Chetumal 77014 Mexico	Scopus	Basic/descriptive science	Unsure - flag for later review		This is describing particular cepholopod paralarvae (early stage larvae) and may not be relevant to whole objective, but obviously has impacts to the ecosystem 
Fulton S.	2023	Article	All Open Access; Gold Open Access	People and Nature	English	Fulton S. Comunidad y Biodiversidad Guaymas Mexico	Comunidad y Biodiversidad Guaymas Mexico	Scopus				
Banaszak A.T.	2021	Book chapter	NA	Anthropogenic Pollution of Aquatic Ecosystems	English	Banaszak A.T. Integrative Reef Conservation Research Laboratory Unidad Académica de Sistemas Arrecifales Universidad Nacional Autónoma de México Puerto Morelos Mexico	Integrative Reef Conservation Research Laboratory Unidad Académica de Sistemas Arrecifales Universidad Nacional Autónoma de México Puerto Morelos Mexico	Scopus				
Gress E.; Arroyo-Gerez M.J.; Wright G.; Andradi-Brown D.A.	2018	Article	All Open Access; Gold Open Access; Green Open Access	Royal Society Open Science	English	Gress E. Conservation Leadership Programme David Attenborough Building Pembroke Street Cambridge CB2 3QZ United Kingdom Nekton Foundation Begbroke Science Park Begbroke Hill Woodstock Road Begbroke Oxfordshire OX5 1PF United Kingdom; Arroyo-Gerez M.J. Conservation Leadership Programme David Attenborough Building Pembroke Street Cambridge CB2 3QZ United Kingdom; Wright G. Operation Wallacea Wallace House Old Bolingbroke Spilsby Lincolnshire PE23 4EX United Kingdom; Andradi-Brown D.A. Conservation Leadership Programme David Attenborough Building Pembroke Street Cambridge CB2 3QZ United Kingdom Ocean Conservation World Wildlife Fund - US 1250 24th St NW Washington 20037 DC United States Department of Zoology University of Oxford South Parks Road Oxford OX1 3PS United Kingdom	Conservation Leadership Programme David Attenborough Building Pembroke Street Cambridge CB2 3QZ United Kingdom; Nekton Foundation Begbroke Science Park Begbroke Hill Woodstock Road Begbroke Oxfordshire OX5 1PF United Kingdom; Operation Wallacea Wallace House Old Bolingbroke Spilsby Lincolnshire PE23 4EX United Kingdom; Ocean Conservation World Wildlife Fund - US 1250 24th St NW Washington 20037 DC United States; Department of Zoology University of Oxford South Parks Road Oxford OX1 3PS United Kingdom	Scopus				
Carrasco Navas-Parejo J.C.; Paspapyrou S.; Haro S.; Caballero de Frutos I.; Corzo A.	2023	Article	All Open Access; Green Open Access; Hybrid Gold Open Access	Science of the Total Environment	English	Carrasco Navas-Parejo J.C. Department of Biology Faculty of Marine and Environmental Sciences University of Cadiz Cadiz Puerto Real 11510 Spain Coastal and Marine Research Los Profesores Main street Atlántida Tela Honduras; Paspapyrou S. Department of Biology Faculty of Marine and Environmental Sciences University of Cadiz Cadiz Puerto Real 11510 Spain Instituto Universitario de Investigacion Marina Campus Universitario de Puerto Real Cadiz 11510 Spain; Haro S. Earth and Ocean Sciences School of Natural Sciences and Ryan Institute University of Galway H91 TK33 Ireland; Caballero de Frutos I. Instituto de Ciencias Marinas de Andalucía (ICMAN) Consejo Superior de Investigaciones Científicas (CSIC) Cádiz Puerto Real 11510 Spain; Corzo A. Department of Biology Faculty of Marine and Environmental Sciences University of Cadiz Cadiz Puerto Real 11510 Spain Instituto Universitario de Investigacion Marina Campus Universitario de Puerto Real Cadiz 11510 Spain	Department of Biology Faculty of Marine and Environmental Sciences University of Cadiz Cadiz Puerto Real 11510 Spain; Coastal and Marine Research Los Profesores Main street Atlántida Tela Honduras; Instituto de Ciencias Marinas de Andalucía (ICMAN) Consejo Superior de Investigaciones Científicas (CSIC) Cádiz Puerto Real 11510 Spain; Earth and Ocean Sciences School of Natural Sciences and Ryan Institute University of Galway H91 TK33 Ireland; Instituto Universitario de Investigacion Marina Campus Universitario de Puerto Real Cadiz 11510 Spain	Scopus				
Gischler E.	2018	Review	NA	Atoll Research Bulletin	English	Gischler E. J.W. Goethe-Universität Institut für Geowissenschaften Altenhöferallee 1 Frankfurt am Main 60438 Germany	J.W. Goethe-Universität Institut für Geowissenschaften Altenhöferallee 1 Frankfurt am Main 60438 Germany	Scopus				
Alcérreca-Huerta J.C.; Reyes-Mendoza O.F.; Sánchez-Sánchez J.A.; Álvarez-Legorreta T.; Carrillo L.	2024	Article	All Open Access; Gold Open Access	Frontiers in Marine Science	English	Alcérreca-Huerta J.C. Department of Observation and Study of the Land the Atmosphere and the Ocean Consejo Nacional de Humanidades Ciencias y Tecnologías-El Colegio de la Frontera Sur (CONAHCYT-ECOSUR) Chetumal Mexico; Reyes-Mendoza O.F. Department of Observation and Study of the Land the Atmosphere and the Ocean Consejo Nacional de Humanidades Ciencias y Tecnologías-El Colegio de la Frontera Sur (CONAHCYT-ECOSUR) Chetumal Mexico; Sánchez-Sánchez J.A. Department of Sustainability Sciences El Colegio de la Frontera Sur Chetumal Mexico; Álvarez-Legorreta T. Department of Sustainability Sciences El Colegio de la Frontera Sur Chetumal Mexico; Carrillo L. Department of Observation and Study of the Land the Atmosphere and the Ocean El Colegio de la Frontera Sur Chetumal Mexico	Department of Observation and Study of the Land the Atmosphere and the Ocean Consejo Nacional de Humanidades Ciencias y Tecnologías-El Colegio de la Frontera Sur (CONAHCYT-ECOSUR) Chetumal Mexico; Department of Sustainability Sciences El Colegio de la Frontera Sur Chetumal Mexico; Department of Observation and Study of the Land the Atmosphere and the Ocean El Colegio de la Frontera Sur Chetumal Mexico	Scopus				
Etnoyer P.J.; Messing C.G.; Stanley K.A.; Baumiller T.K.; Lavelle K.; Shirley T.C.	2022	Article	All Open Access; Hybrid Gold Open Access	Marine Biodiversity	English	Etnoyer P.J. NOAA National Centers for Coastal Ocean Science Hollings Marine Laboratory Charleston SC United States; Messing C.G. Department of Marine and Environmental Sciences Nova Southeastern University Dania Beach FL United States; Stanley K.A. Roatan Institute for Deepsea Exploration Roatán Honduras; Baumiller T.K. Museum of Paleontology and Department of Earth and Environmental Sciences University of Michigan Ann Arbor MI United States; Lavelle K. Texas Commission On Environmental Quality Austin TX United States; Shirley T.C. Dept. of Life Sciences and Harte Research Institute Texas A&M University-Corpus Christi Corpus Christi TX United States	NOAA National Centers for Coastal Ocean Science Hollings Marine Laboratory Charleston SC United States; Department of Marine and Environmental Sciences Nova Southeastern University Dania Beach FL United States; Roatan Institute for Deepsea Exploration Roatán Honduras; Museum of Paleontology and Department of Earth and Environmental Sciences University of Michigan Ann Arbor MI United States; Texas Commission On Environmental Quality Austin TX United States; Dept. of Life Sciences and Harte Research Institute Texas A&M University-Corpus Christi Corpus Christi TX United States	Scopus				
Padilla-Saldívar J.A.; Sánchez-Okrucky R.; Romero-Tenorio A.; Navarro-Solano H.; Serrano-Barriga L.; Arreola-Illescas M.R.; Castelblanco-Martínez D.N.	2024	Article	NA	Mammalia	English	Padilla-Saldívar J.A. Departamento de Sistemática y Ecología Acuática Laboratorio de Mamíferos Acuáticos El Colegio de la Frontera sur. Quintana Roo Chetumal Mexico; Sánchez-Okrucky R. Asociacion Mexicana de Habitats Para la Interaccion y Proteccion de Mamiferos Marinos Quintana Roo Puerto Aventuras Mexico; Romero-Tenorio A. Aquademia Educación Contínua S. C. Quintana Roo Playa del Carmen Mexico; Navarro-Solano H. Comisión Nacional de Áreas Naturales Protegidas Quintana Roo Cancún Mexico; Serrano-Barriga L. Asociacion Mexicana de Habitats Para la Interaccion y Proteccion de Mamiferos Marinos Quintana Roo Puerto Aventuras Mexico; Arreola-Illescas M.R. Asociacion Mexicana de Habitats Para la Interaccion y Proteccion de Mamiferos Marinos Quintana Roo Puerto Aventuras Mexico; Castelblanco-Martínez D.N. Departamento de Sistemática y Ecología Acuática Laboratorio de Mamíferos Acuáticos El Colegio de la Frontera sur. Quintana Roo Chetumal Mexico Fundación Internacional Para la Naturaleza y la Sustentabilidad Quintana Roo Chetumal Mexico	Departamento de Sistemática y Ecología Acuática Laboratorio de Mamíferos Acuáticos El Colegio de la Frontera sur. Quintana Roo Chetumal Mexico; Asociacion Mexicana de Habitats Para la Interaccion y Proteccion de Mamiferos Marinos Quintana Roo Puerto Aventuras Mexico; Aquademia Educación Contínua S. C. Quintana Roo Playa del Carmen Mexico; Comisión Nacional de Áreas Naturales Protegidas Quintana Roo Cancún Mexico; Fundación Internacional Para la Naturaleza y la Sustentabilidad Quintana Roo Chetumal Mexico	Scopus				
Husband E.; East H.K.; Hocking E.P.; Guest J.	2023	Article	All Open Access; Gold Open Access	Remote Sensing	English	Husband E. Department of Geography and Environmental Sciences Faculty of Engineering and Environment Northumbria University Newcastle upon Tyne NE1 8ST United Kingdom; East H.K. Department of Geography and Environmental Sciences Faculty of Engineering and Environment Northumbria University Newcastle upon Tyne NE1 8ST United Kingdom; Hocking E.P. Department of Geography and Environmental Sciences Faculty of Engineering and Environment Northumbria University Newcastle upon Tyne NE1 8ST United Kingdom; Guest J. School of Natural & Environmental Sciences Newcastle University Newcastle upon Tyne NE1 7RU United Kingdom	Department of Geography and Environmental Sciences Faculty of Engineering and Environment Northumbria University Newcastle upon Tyne NE1 8ST United Kingdom; School of Natural & Environmental Sciences Newcastle University Newcastle upon Tyne NE1 7RU United Kingdom	Scopus				
Moran B.M.; Hench K.; Waples R.S.; Höppner M.P.; Baldwin C.C.; McMillan W.O.; Puebla O.	2019	Article	All Open Access; Green Open Access	Molecular Ecology	English	Moran B.M. Marine Evolutionary Ecology GEOMAR Helmholtz Centre for Ocean Research Kiel Kiel Germany Department of Marine and Environmental Sciences Northeastern University Boston MA United States; Hench K. Marine Evolutionary Ecology GEOMAR Helmholtz Centre for Ocean Research Kiel Kiel Germany; Waples R.S. Northwest Fisheries Science Center National Marine Fisheries Service NOAA Seattle Washington DC United States; Höppner M.P. Institute of Clinical Molecular Biology Kiel University Kiel Germany; Baldwin C.C. Department of Vertebrate Zoology National Museum of Natural History Smithsonian Institution Washington DC United States; McMillan W.O. Smithsonian Tropical Research Institute Panamá Panama; Puebla O. Marine Evolutionary Ecology GEOMAR Helmholtz Centre for Ocean Research Kiel Kiel Germany Smithsonian Tropical Research Institute Panamá Panama Faculty of Mathematics and Natural Sciences University of Kiel Kiel Germany	Marine Evolutionary Ecology GEOMAR Helmholtz Centre for Ocean Research Kiel Kiel Germany; Department of Marine and Environmental Sciences Northeastern University Boston MA United States; Northwest Fisheries Science Center National Marine Fisheries Service NOAA Seattle Washington DC United States; Institute of Clinical Molecular Biology Kiel University Kiel Germany; Department of Vertebrate Zoology National Museum of Natural History Smithsonian Institution Washington DC United States; Smithsonian Tropical Research Institute Panamá Panama; Faculty of Mathematics and Natural Sciences University of Kiel Kiel Germany	Scopus				
Pérez-Posada I.; Cabanillas-Terán N.; Rosas-Luis R.; Hernández-Arana H.A.; Sánchez-Gonzalez A.	2023	Article	NA	Regional Studies in Marine Science	English	Pérez-Posada I. Departamento de Sistemática y Ecología Acuática El Colegio de la Frontera Sur. Av. Centenario Km 5.5 Quintana Roo Chetumal 77014 Mexico; Cabanillas-Terán N. Departamento de Sistemática y Ecología Acuática El Colegio de la Frontera Sur. Av. Centenario Km 5.5 Quintana Roo Chetumal 77014 Mexico; Rosas-Luis R. IxM CONAHCYT - Tecnológico Nacional de México/I. T. Chetumal. Av. Insurgentes 330 Quintana Roo Chetumal 77013 Mexico Tecnológico Nacional de México/I. T. Chetumal. Av. Insurgentes 330 Quintana Roo Chetumal 77013 Mexico; Hernández-Arana H.A. Departamento de Sistemática y Ecología Acuática El Colegio de la Frontera Sur. Av. Centenario Km 5.5 Quintana Roo Chetumal 77014 Mexico; Sánchez-Gonzalez A. Centro Interdisciplinario de Ciencias Marinas del Instituto Politécnico Nacional. Av. Instituto Politécnico Nacional s/n Baja California Sur La Paz 23096 Mexico	Departamento de Sistemática y Ecología Acuática El Colegio de la Frontera Sur. Av. Centenario Km 5.5 Quintana Roo Chetumal 77014 Mexico; IxM CONAHCYT - Tecnológico Nacional de México/I. T. Chetumal. Av. Insurgentes 330 Quintana Roo Chetumal 77013 Mexico; Tecnológico Nacional de México/I. T. Chetumal. Av. Insurgentes 330 Quintana Roo Chetumal 77013 Mexico; Centro Interdisciplinario de Ciencias Marinas del Instituto Politécnico Nacional. Av. Instituto Politécnico Nacional s/n Baja California Sur La Paz 23096 Mexico	Scopus				
Martínez S.; Carrillo L.; Marinone S.G.	2019	Article	NA	Ecological Indicators	English	Martínez S. El Colegio de la Frontera Sur Departamento de Sistemática y Ecología Acuática Av. Centenario km 5.5 Chetumal Quintana Roo Mexico; Carrillo L. El Colegio de la Frontera Sur Departamento de Sistemática y Ecología Acuática Av. Centenario km 5.5 Chetumal Quintana Roo Mexico; Marinone S.G. Departamento de Oceanografia Fisica CICESE Carretera Transpeninsular Ensenada-Tijuana Km 107 Ensenada Baja California Mexico	El Colegio de la Frontera Sur Departamento de Sistemática y Ecología Acuática Av. Centenario km 5.5 Chetumal Quintana Roo Mexico; Departamento de Oceanografia Fisica CICESE Carretera Transpeninsular Ensenada-Tijuana Km 107 Ensenada Baja California Mexico	Scopus				
León-Araúz P.; Cabezas-García M.; Faber P.; Reimerink A.	2023	Conference paper	NA	CEUR Workshop Proceedings	English	León-Araúz P. University of Granada Departamento de Traducción e Interpretación C/ Buensuceso 11 Granada 18071 Spain; Cabezas-García M. University of Granada Departamento de Traducción e Interpretación C/ Buensuceso 11 Granada 18071 Spain; Faber P. University of Granada Departamento de Traducción e Interpretación C/ Buensuceso 11 Granada 18071 Spain; Reimerink A. University of Granada Departamento de Traducción e Interpretación C/ Buensuceso 11 Granada 18071 Spain	University of Granada Departamento de Traducción e Interpretación C/ Buensuceso 11 Granada 18071 Spain	Scopus				
Baumann J.H.; Bove C.B.; Carne L.; Gutierrez I.; Castillo K.D.	2021	Article	NA	Coral Reefs	English	Baumann J.H. Department of Marine Sciences The University of North Carolina Chapel Hill United States Biology Department Bowdoin College Brunswick United States; Bove C.B. Environment Ecology and Energy Program The University of North Carolina Chapel Hill United States; Carne L. Fragments of Hope Ltd Placencia Belize; Gutierrez I. Department of Environmental Earth and Geospatial Sciences North Carolina Central University Durham United States; Castillo K.D. Department of Marine Sciences The University of North Carolina Chapel Hill United States Environment Ecology and Energy Program The University of North Carolina Chapel Hill United States	Department of Marine Sciences The University of North Carolina Chapel Hill United States; Biology Department Bowdoin College Brunswick United States; Environment Ecology and Energy Program The University of North Carolina Chapel Hill United States; Fragments of Hope Ltd Placencia Belize; Department of Environmental Earth and Geospatial Sciences North Carolina Central University Durham United States	Scopus				
Solano N.; Lopez-Ercilla I.; Fernandez-Rivera Melo F.J.; Torre J.	2021	Article	All Open Access; Gold Open Access	Frontiers in Marine Science	English	Solano N. Comunidad y Biodiversidad A.C Guaymas Mexico; Lopez-Ercilla I. Comunidad y Biodiversidad A.C Guaymas Mexico; Fernandez-Rivera Melo F.J. Comunidad y Biodiversidad A.C Guaymas Mexico; Torre J. Comunidad y Biodiversidad A.C Guaymas Mexico	Comunidad y Biodiversidad A.C Guaymas Mexico	Scopus				
Zoppe S.F.; Gischler E.	2024	Article	All Open Access; Hybrid Gold Open Access	Journal of Quaternary Science	English	Zoppe S.F. Institut für Geowissenschaften Goethe-Universität Frankfurt am Main Altenhöferallee 1 Frankfurt am Main 60438 Germany; Gischler E. Institut für Geowissenschaften Goethe-Universität Frankfurt am Main Altenhöferallee 1 Frankfurt am Main 60438 Germany	Institut für Geowissenschaften Goethe-Universität Frankfurt am Main Altenhöferallee 1 Frankfurt am Main 60438 Germany	Scopus				
Japaud A.; Bouchon C.; Magalon H.; Fauvelot C.	2019	Article	NA	Conservation Genetics	English	Japaud A. UMR 7208 BOREA Laboratoire d’excellence-CORAIL Université des Antilles Pointe-à-Pitre BP592 97159 Guadeloupe UMR ENTROPIE (IRD Université de La Réunion CNRS) Laboratoire d’excellence-CORAIL IRD de Nouméa 101 Promenade Roger Laroque BP A5 Nouméa cedex 98848 New Caledonia; Bouchon C. UMR 7208 BOREA Laboratoire d’excellence-CORAIL Université des Antilles Pointe-à-Pitre BP592 97159 Guadeloupe; Magalon H. UMR ENTROPIE (Université de La Réunion IRD CNRS) Laboratoire d’excellence-CORAIL Faculté des Sciences et Technologies 15 Bd René Cassin CS92003 St Denis Cedex 09 La Réunion 97744 France; Fauvelot C. UMR ENTROPIE (IRD Université de La Réunion CNRS) Laboratoire d’excellence-CORAIL IRD de Nouméa 101 Promenade Roger Laroque BP A5 Nouméa cedex 98848 New Caledonia Université Côte d’Azur CNRS FRE 3729 ECOMERS Parc Valrose 28 Avenue Valrose Nice 06108 France Sorbonne Université CNRS Laboratoire d’Océanographie de Villefranche LOV Villefranche-sur-Mer 06230 France	UMR 7208 BOREA Laboratoire d’excellence-CORAIL Université des Antilles Pointe-à-Pitre BP592 97159 Guadeloupe; UMR ENTROPIE (IRD Université de La Réunion CNRS) Laboratoire d’excellence-CORAIL IRD de Nouméa 101 Promenade Roger Laroque BP A5 Nouméa cedex 98848 New Caledonia; UMR ENTROPIE (Université de La Réunion IRD CNRS) Laboratoire d’excellence-CORAIL Faculté des Sciences et Technologies 15 Bd René Cassin CS92003 St Denis Cedex 09 La Réunion 97744 France; Université Côte d’Azur CNRS FRE 3729 ECOMERS Parc Valrose 28 Avenue Valrose Nice 06108 France; Sorbonne Université CNRS Laboratoire d’Océanographie de Villefranche LOV Villefranche-sur-Mer 06230 France	Scopus				
Hernández-Olascoaga A.; González-Solís D.; Aznar F.J.	2022	Article	NA	Estuarine Coastal and Shelf Science	English	Hernández-Olascoaga A. Departamento de Sistemática y Ecología Acuática El Colegio de la Frontera Sur Unidad Chetumal Avenida Centenario km. 5.5 Quintana Roo Chetumal 77040 Mexico; González-Solís D. Departamento de Sistemática y Ecología Acuática El Colegio de la Frontera Sur Unidad Chetumal Avenida Centenario km. 5.5 Quintana Roo Chetumal 77040 Mexico; Aznar F.J. Unidad de Zoología Marina Instituto Cavanilles de Biodiversidad y Biología Evolutiva Universitat de Valencia Valencia 46071 Spain	Departamento de Sistemática y Ecología Acuática El Colegio de la Frontera Sur Unidad Chetumal Avenida Centenario km. 5.5 Quintana Roo Chetumal 77040 Mexico; Unidad de Zoología Marina Instituto Cavanilles de Biodiversidad y Biología Evolutiva Universitat de Valencia Valencia 46071 Spain	Scopus				
Casas-Beltrán D.A.; Febles-Moreno K.; Hernandez-Yac E.; Gallaher C.M.; Alvarado-Flores J.; Leal-Bautista R.M.; Lenczewski M.	2021	Article	All Open Access; Gold Open Access	Applied Sciences (Switzerland)	English	Casas-Beltrán D.A. Centro de Investigación Científica de Yucatán A.C. Unidad de Ciencias del Agua Cancún CP 77524 Mexico; Febles-Moreno K. Pontificia Universidad Católica de Puerto Rico Ponce 00717 PR United States; Hernandez-Yac E. Department of Geographic and Atmospheric Sciences Northern Illinois University DeKalb 60115 IL United States; Gallaher C.M. Department of Geographic and Atmospheric Sciences Northern Illinois University DeKalb 60115 IL United States; Alvarado-Flores J. Centro de Investigación Científica de Yucatán A.C. Unidad de Ciencias del Agua Cancún CP 77524 Mexico; Leal-Bautista R.M. Centro de Investigación Científica de Yucatán A.C. Unidad de Ciencias del Agua Cancún CP 77524 Mexico; Lenczewski M. Department of Geology and Environmental Geosciences Northern Illinois University Dekalb 60115 IL United States	Centro de Investigación Científica de Yucatán A.C. Unidad de Ciencias del Agua Cancún CP 77524 Mexico; Pontificia Universidad Católica de Puerto Rico Ponce 00717 PR United States; Department of Geographic and Atmospheric Sciences Northern Illinois University DeKalb 60115 IL United States; Department of Geology and Environmental Geosciences Northern Illinois University Dekalb 60115 IL United States	Scopus				
Gress E.; Voss J.D.; Eckert R.J.; Rowlands G.; Andradi-Brown D.A.	2019	Book chapter	NA	Coral Reefs of the World	English	Gress E. Nekton Foundation Begbroke Science Park Begbroke United Kingdom; Voss J.D. Harbor Branch Oceanographic Institute Florida Atlantic University Fort Pierce FL United States; Eckert R.J. Harbor Branch Oceanographic Institute Florida Atlantic University Fort Pierce FL United States; Rowlands G. Department of Zoology University of Oxford John Krebs Field Station Oxford United Kingdom; Andradi-Brown D.A. Department of Zoology University of Oxford John Krebs Field Station Oxford United Kingdom Ocean Conservation World Wildlife Fund Washington DC United States	Nekton Foundation Begbroke Science Park Begbroke United Kingdom; Harbor Branch Oceanographic Institute Florida Atlantic University Fort Pierce FL United States; Department of Zoology University of Oxford John Krebs Field Station Oxford United Kingdom; Ocean Conservation World Wildlife Fund Washington DC United States	Scopus				
Baumbach D.S.; Zhang R.; Hayes C.T.; Wright M.K.; Dunbar S.G.	2022	Article	NA	Marine Ecology	English	Baumbach D.S. Protective Turtle Ecology Center for Training Outreach and Research Inc. (ProTECTOR Inc.) Loma Linda CA United States Marine Research Group Department of Earth and Biological Sciences Loma Linda University Loma Linda CA United States; Zhang R. College of Natural Sciences Department of Chemistry and Biochemistry California State University San Bernardino San Bernardino CA United States; Hayes C.T. Protective Turtle Ecology Center for Training Outreach and Research Inc. (ProTECTOR Inc.) Loma Linda CA United States Marine Research Group Department of Earth and Biological Sciences Loma Linda University Loma Linda CA United States Department of Biology Environmental Science and Health Science Waynesburg University Waynesburg PA United States; Wright M.K. Protective Turtle Ecology Center for Training Outreach and Research Inc. (ProTECTOR Inc.) Loma Linda CA United States Marine Research Group Department of Earth and Biological Sciences Loma Linda University Loma Linda CA United States; Dunbar S.G. Protective Turtle Ecology Center for Training Outreach and Research Inc. (ProTECTOR Inc.) Loma Linda CA United States Marine Research Group Department of Earth and Biological Sciences Loma Linda University Loma Linda CA United States	Protective Turtle Ecology Center for Training Outreach and Research Inc. (ProTECTOR Inc.) Loma Linda CA United States; Marine Research Group Department of Earth and Biological Sciences Loma Linda University Loma Linda CA United States; College of Natural Sciences Department of Chemistry and Biochemistry California State University San Bernardino San Bernardino CA United States; Department of Biology Environmental Science and Health Science Waynesburg University Waynesburg PA United States	Scopus				
