Garcia M.	2019	Conference paper	NA	1st EAGE Workshop on Advanced Seismic Solutions and New Exploration Concepts to Unlock the Potential of the Caribbean Shelf	English	Garcia M. Industrial University of Santander Colombia	Industrial University of Santander Colombia	Scopus				
Anker A.	2011	Article	NA	Marine Biodiversity Records	English	Anker A. Instituto de Ciências Do Mar (Labomar) Universidade Federal Do Ceará Fortaleza CE Brazil	Instituto de Ciências Do Mar (Labomar) Universidade Federal Do Ceará Fortaleza CE Brazil	Scopus				
Ng C.H.J.; Vecchi G.A.	2020	Article	NA	Climate Dynamics	English	Ng C.H.J. Atmospheric and Oceanic Sciences (AOS) Princeton University 300 Forrestal Road Sayre Hall Princeton 08540-6659 NJ United States; Vecchi G.A. Atmospheric and Oceanic Sciences (AOS) Princeton University 300 Forrestal Road Sayre Hall Princeton 08540-6659 NJ United States Department of Geosciences Princeton University Princeton 08540-6649 NJ United States Princeton Environmental Institute Princeton University Princeton 08540-6649 NJ United States	Atmospheric and Oceanic Sciences (AOS) Princeton University 300 Forrestal Road Sayre Hall Princeton 08540-6659 NJ United States; Department of Geosciences Princeton University Princeton 08540-6649 NJ United States; Princeton Environmental Institute Princeton University Princeton 08540-6649 NJ United States	Scopus				
Rivers T.J.; Morin J.G.	2008	Article	All Open Access; Bronze Open Access; Green Open Access	Journal of Experimental Biology	English	Rivers T.J. Department of Ecology and Evolutionary Biology Cornell University New York NY 85201 United States; Morin J.G. Department of Ecology and Evolutionary Biology Cornell University New York NY 85201 United States	Department of Ecology and Evolutionary Biology Cornell University New York NY 85201 United States	Scopus				
Ishizaki N.N.; Nakaegawa T.; Pinzón R.; Sasaki H.	2023	Article	All Open Access; Gold Open Access	Frontiers in Earth Science	English	Ishizaki N.N. Center for Climate Change Adaptation National Institute for Environmental Studies Ibaraki Tsukuba Japan; Nakaegawa T. Department of Applied Meteorology Research Meteorological Research Institute Ibaraki Tsukuba Japan; Pinzón R. Universidad Tecnológica de Panamá Centro de Investigaciones Hidráulicas e Hidrotécnicas Group HPC-Cluster-Iberogun Panamá City Panama; Sasaki H. Center for Climate Change Adaptation National Institute for Environmental Studies Ibaraki Tsukuba Japan	Center for Climate Change Adaptation National Institute for Environmental Studies Ibaraki Tsukuba Japan; Department of Applied Meteorology Research Meteorological Research Institute Ibaraki Tsukuba Japan; Universidad Tecnológica de Panamá Centro de Investigaciones Hidráulicas e Hidrotécnicas Group HPC-Cluster-Iberogun Panamá City Panama	Scopus				
Corporal-Lodangco I.L.; Richman M.B.; Leslie L.M.; Lamb P.J.	2014	Conference paper	All Open Access; Gold Open Access; Green Open Access	Procedia Computer Science	English	Corporal-Lodangco I.L. Cooperative Institute for Mesoscale Meteorological Studies United States; Richman M.B. Cooperative Institute for Mesoscale Meteorological Studies United States University of Oklahoma United States; Leslie L.M. Cooperative Institute for Mesoscale Meteorological Studies United States University of Oklahoma United States; Lamb P.J. Cooperative Institute for Mesoscale Meteorological Studies United States	Cooperative Institute for Mesoscale Meteorological Studies United States; University of Oklahoma United States	Scopus				
Martinez J.I.; Mora G.; Barrows T.T.	2007	Article	All Open Access; Green Open Access	Marine Micropaleontology	English	Martinez J.I. Departamento de Geología Area de Ciencias del Mar Universidad Eafit Medellín A.A. 3300 Colombia; Mora G. Department of Geological and Atmospheric Sciences Iowa State University Ames IA 50011 United States; Barrows T.T. Department of Nuclear Physics Research School of Physical Sciences and Engineering The Australian National University Camberra ACT 0200 Australia	Departamento de Geología Area de Ciencias del Mar Universidad Eafit Medellín A.A. 3300 Colombia; Department of Geological and Atmospheric Sciences Iowa State University Ames IA 50011 United States; Department of Nuclear Physics Research School of Physical Sciences and Engineering The Australian National University Camberra ACT 0200 Australia	Scopus				
Elsner J.B.; Niu X.; Jagger T.H.	2004	Article	All Open Access; Bronze Open Access	Journal of Climate	English	Elsner J.B. Department of Geography The Florida State University Tallahassee FL 32306 United States; Niu X. Department of Statistics The Florida State University Tallahassee FL United States; Jagger T.H. Insightful Corporation Seattle WA United States	Department of Geography The Florida State University Tallahassee FL 32306 United States; Department of Statistics The Florida State University Tallahassee FL United States; Insightful Corporation Seattle WA United States	Scopus				
Juárez-de la Rosa B.A.; Ardisson P.-L.; Azamar-Barrios J.A.; Quintana P.; Alvarado-Gil J.J.	2007	Article	NA	Materials Science and Engineering C	English	Juárez-de la Rosa B.A. Marine Resources Department Cinvestav Unidad Mérida Cordemex 97310 Merida Yucatan Carretera antigua a Progreso km 6 Mexico; Ardisson P.-L. Marine Resources Department Cinvestav Unidad Mérida Cordemex 97310 Merida Yucatan Carretera antigua a Progreso km 6 Mexico; Azamar-Barrios J.A. Applied Physics Department Cinvestav Unidad Mérida Cordemex 97310 Merida Yucatan Carretera antigua a Progreso km 6 Mexico; Quintana P. Applied Physics Department Cinvestav Unidad Mérida Cordemex 97310 Merida Yucatan Carretera antigua a Progreso km 6 Mexico; Alvarado-Gil J.J. Applied Physics Department Cinvestav Unidad Mérida Cordemex 97310 Merida Yucatan Carretera antigua a Progreso km 6 Mexico	Marine Resources Department Cinvestav Unidad Mérida Cordemex 97310 Merida Yucatan Carretera antigua a Progreso km 6 Mexico; Applied Physics Department Cinvestav Unidad Mérida Cordemex 97310 Merida Yucatan Carretera antigua a Progreso km 6 Mexico	Scopus				
Schaeffner B.C.	2018	Article	NA	Journal of Parasitology	English	Schaeffner B.C. Instituto de Biociências Universidade de São Paulo Rua do Matão 321 São Paulo SP 05508-090 Brazil Water Research Group Unit for Environmental Sciences and Management North-West University Private Bag X6001 Potchefstroom 2520 South Africa	Instituto de Biociências Universidade de São Paulo Rua do Matão 321 São Paulo SP 05508-090 Brazil; Water Research Group Unit for Environmental Sciences and Management North-West University Private Bag X6001 Potchefstroom 2520 South Africa	Scopus				
Sanchez J.; Mann P.; Carvajal-Arenas L.C.; Bernal-Olaya R.	2019	Article	NA	AAPG Bulletin	English	Sanchez J. Department of Earth and Atmospheric Sciences University of Houston Houston TX United States Ecopetrol S.A. Bogotá D.C. Colombia United States; Mann P. Department of Earth and Atmospheric Sciences University of Houston Houston TX United States; Carvajal-Arenas L.C. Department of Earth and Atmospheric Sciences University of Houston Houston TX United States AGI Exploration Houston TX United States; Bernal-Olaya R. Department of Earth and Atmospheric Sciences University of Houston Houston TX United States Universidad Industrial de Santander Bucaramanga Santander Colombia	Department of Earth and Atmospheric Sciences University of Houston Houston TX United States; Ecopetrol S.A. Bogotá D.C. Colombia United States; AGI Exploration Houston TX United States; Universidad Industrial de Santander Bucaramanga Santander Colombia	Scopus				
Gasca R.	2009	Article	All Open Access; Bronze Open Access	Zootaxa	English	Gasca R. El Colegio de la Frontera Sur (ECOSUR) Unidad Chetumal. A.P. 424. Chetumal Quintana Roo 77014 Mexico	El Colegio de la Frontera Sur (ECOSUR) Unidad Chetumal. A.P. 424. Chetumal Quintana Roo 77014 Mexico	Scopus				
Carrera-Parra L.F.; Rizzo A.E.; Salazar-Vallejo S.I.	2008	Article	NA	Journal of the Marine Biological Association of the United Kingdom	English	Carrera-Parra L.F. El Colegio de la Frontera Sur Departamento de Ecología Acuática Chetumal Q. Roo 77014 Ave. Centenario Km 5.5 Mexico; Rizzo A.E. Departamento de Zoologia IB UNICAMP 13.063-970 Campinas Estado de São Paulo CP 6109 Brazil; Salazar-Vallejo S.I. El Colegio de la Frontera Sur Departamento de Ecología Acuática Chetumal Q. Roo 77014 Ave. Centenario Km 5.5 Mexico	El Colegio de la Frontera Sur Departamento de Ecología Acuática Chetumal Q. Roo 77014 Ave. Centenario Km 5.5 Mexico; Departamento de Zoologia IB UNICAMP 13.063-970 Campinas Estado de São Paulo CP 6109 Brazil	Scopus				
Condal A.R.; Vega-Moro A.; Ardisson P.-L.	2013	Article	NA	International Journal of Remote Sensing	English	Condal A.R. Département des sciences géomantiques Université Laval Québec G1K 7P4 Canada; Vega-Moro A. Departamento de Recursos del Mar Cinvestav 97310 Mérida Yucatán Mexico; Ardisson P.-L. Departamento de Recursos del Mar Cinvestav 97310 Mérida Yucatán Mexico	Département des sciences géomantiques Université Laval Québec G1K 7P4 Canada; Departamento de Recursos del Mar Cinvestav 97310 Mérida Yucatán Mexico	Scopus				
Villalobos-León R.I.; Mendoza-Becerril M.A.	2025	Article	NA	Zootaxa	English	Villalobos-León R.I. Escuela de Ciencias Biológicas Facultad de Ciencias Exactas y Naturales Universidad Nacional de Costa Rica Costa Rica; Mendoza-Becerril M.A. Departamento de Sistemática y Ecología Acuática El Colegio de la Frontera Sur Quintana Roo Chetumal 77014 Mexico	Escuela de Ciencias Biológicas Facultad de Ciencias Exactas y Naturales Universidad Nacional de Costa Rica Costa Rica; Departamento de Sistemática y Ecología Acuática El Colegio de la Frontera Sur Quintana Roo Chetumal 77014 Mexico	Scopus				
Gou Y.; Wang C.	2022	Article	All Open Access; Gold Open Access	Sustainability (Switzerland)	English	Gou Y. Institute of Geographic Sciences and Natural Resources Research Chinese Academy of Sciences Beijing 100101 China College of Resources and Environment University of Chinese Academy of Sciences Beijing 100049 China; Wang C. Institute of Geographic Sciences and Natural Resources Research Chinese Academy of Sciences Beijing 100101 China College of Resources and Environment University of Chinese Academy of Sciences Beijing 100049 China	Institute of Geographic Sciences and Natural Resources Research Chinese Academy of Sciences Beijing 100101 China; College of Resources and Environment University of Chinese Academy of Sciences Beijing 100049 China	Scopus				
Yoo J.; Collins J.M.; Rohli R.V.	2015	Article	NA	Professional Geographer	English	Yoo J. Department of Earth and Planetary Sciences University of New Mexico Albuquerque 87131 NM United States; Collins J.M. Department of Geography Environmental Science and Planning University of South Florida Tampa 33620 FL United States; Rohli R.V. Department of Geography and Anthropology Louisiana State University Baton Rouge 70803 LA United States	Department of Earth and Planetary Sciences University of New Mexico Albuquerque 87131 NM United States; Department of Geography Environmental Science and Planning University of South Florida Tampa 33620 FL United States; Department of Geography and Anthropology Louisiana State University Baton Rouge 70803 LA United States	Scopus				
Carrera-Parra L.F.; Fauchald K.; Gambi M.C.	2011	Article	NA	Italian Journal of Zoology	English	Carrera-Parra L.F. Colegio de la frontera Sur Departamento de Ecologia Acuàtica Chetumal Quintana Roo México Mexico; Fauchald K. Smithsonian Institution of Natural History Washington DC United States; Gambi M.C. Stazione Zoologica Anton Dohrn Napoli Group of Benthic Ecology (Ischia) Laboratory of Functional and Evolutionary Ecology Napoli Italy	Colegio de la frontera Sur Departamento de Ecologia Acuàtica Chetumal Quintana Roo México Mexico; Smithsonian Institution of Natural History Washington DC United States; Stazione Zoologica Anton Dohrn Napoli Group of Benthic Ecology (Ischia) Laboratory of Functional and Evolutionary Ecology Napoli Italy	Scopus				
Jordan B.R.; Sigurdsson H.; Carey S.N.; Rogers R.; Ehrenborg J.	2006	Conference paper	NA	Special Paper of the Geological Society of America	English	Jordan B.R. Department of Geology United Arab Emirates University Al Ain P.O. Box 17551 United Arab Emirates; Sigurdsson H. Graduate School of Oceanography University of Rhode Island Narragansett RI 02882-1197 United States; Carey S.N. Graduate School of Oceanography University of Rhode Island Narragansett RI 02882-1197 United States; Rogers R. Department of Geology United Arab Emirates University Al Ain P.O. Box 17551 United Arab Emirates; Ehrenborg J. Revista del Centro de Investigaciones Geoscientificas (CIGEO) Colonia Miguel Bonilla No. 165 CC. Managua Apartado Postal A-131 Nicaragua	Department of Geology United Arab Emirates University Al Ain P.O. Box 17551 United Arab Emirates; Graduate School of Oceanography University of Rhode Island Narragansett RI 02882-1197 United States; Revista del Centro de Investigaciones Geoscientificas (CIGEO) Colonia Miguel Bonilla No. 165 CC. Managua Apartado Postal A-131 Nicaragua	Scopus				
Elsner J.B.; Jagger T.H.	2004	Conference paper	NA	26th Conference on Hurricanes and Tropical Meteorology	English	Elsner J.B. Florida State University Tallahassee FL United States Florida State University Department of Geography Tallahassee FL United States; Jagger T.H. Florida State University Tallahassee FL United States	Florida State University Tallahassee FL United States; Florida State University Department of Geography Tallahassee FL United States	Scopus				
Athié G.; Candela J.; Ochoa J.; Sheinbaum J.	2012	Article	All Open Access; Bronze Open Access	Journal of Geophysical Research: Oceans	English	Athié G. Departamento de Oceanografia Fisica CICESE CP 22860 Ensenada Baja California Carretera Ensenada-Tijuana 3918 Zona Playitas Mexico; Candela J. Departamento de Oceanografia Fisica CICESE CP 22860 Ensenada Baja California Carretera Ensenada-Tijuana 3918 Zona Playitas Mexico; Ochoa J. Departamento de Oceanografia Fisica CICESE CP 22860 Ensenada Baja California Carretera Ensenada-Tijuana 3918 Zona Playitas Mexico; Sheinbaum J. Departamento de Oceanografia Fisica CICESE CP 22860 Ensenada Baja California Carretera Ensenada-Tijuana 3918 Zona Playitas Mexico	Departamento de Oceanografia Fisica CICESE CP 22860 Ensenada Baja California Carretera Ensenada-Tijuana 3918 Zona Playitas Mexico	Scopus				
Suárez-Morales E.; Tovar E.	2004	Article	NA	Sarsia	English	Suárez-Morales E. El Colegio de la Frontera Sur Unidad Chetumal Quintana Roo 77000 A.P. 424 Chetumal Mexico National Museum of Natural History Washington DC United States; Tovar E. El Colegio de la Frontera Sur Unidad Chetumal Quintana Roo 77000 A.P. 424 Chetumal Mexico	El Colegio de la Frontera Sur Unidad Chetumal Quintana Roo 77000 A.P. 424 Chetumal Mexico; National Museum of Natural History Washington DC United States	Scopus				
Torrado L.; Carvajal-Arenas L.C.; Sanchez J.; Mann P.; Silva-Tamayo J.C.	2019	Article	NA	AAPG Bulletin	English	Torrado L. Department of Earth and Atmospheric Sciences University of Houston Houston TX United States; Carvajal-Arenas L.C. Department of Earth and Atmospheric Sciences University of Houston Houston TX United States Applied Geosciences through Innovative Exploration Houston TX United States; Sanchez J. Department of Earth and Atmospheric Sciences University of Houston Houston TX United States Ecopetrol Bogotá Colombia; Mann P. Department of Earth and Atmospheric Sciences University of Houston Houston TX United States; Silva-Tamayo J.C. Department of Earth and Atmospheric Sciences University of Houston Houston TX United States Natural Sciences Faculty Antonio Nariño University Campus Circunvalar Bogotá Colombia	Department of Earth and Atmospheric Sciences University of Houston Houston TX United States; Applied Geosciences through Innovative Exploration Houston TX United States; Ecopetrol Bogotá Colombia; Natural Sciences Faculty Antonio Nariño University Campus Circunvalar Bogotá Colombia	Scopus				
Sheng J.	2006	Conference paper	NA	Proceedings of the International Conference on Estuarine and Coastal Modeling	English	Sheng J. Department of Oceanography Dalhousie University Halifax NS B3H 4J1 Canada	Department of Oceanography Dalhousie University Halifax NS B3H 4J1 Canada	Scopus				
Carvajal-Arenas L.C.; Torrado L.; Mann P.	2015	Book chapter	NA	AAPG Memoir	English	Carvajal-Arenas L.C. Department of Earth and Atmospheric Sciences University of Houston Houston 77004 TX United States; Torrado L. Department of Earth and Atmospheric Sciences University of Houston Houston 77004 TX United States; Mann P. Department of Earth and Atmospheric Sciences University of Houston Houston 77004 TX United States	Department of Earth and Atmospheric Sciences University of Houston Houston 77004 TX United States	Scopus				
Lyons S.W.	2004	Article	All Open Access; Bronze Open Access	Weather and Forecasting	English	Lyons S.W. The Weather Channel Atlanta GA 30339 United States	The Weather Channel Atlanta GA 30339 United States	Scopus				
Sheng J.; Tang L.	2004	Conference paper	NA	Ocean Dynamics	English	Sheng J. Department of Oceanography Dalhousie University Halifax NS B3H 4J1 Canada; Tang L. Department of Oceanography Dalhousie University Halifax NS B3H 4J1 Canada	Department of Oceanography Dalhousie University Halifax NS B3H 4J1 Canada	Scopus				
Manzanilla-Dominguez H.; Gasca R.	2004	Erratum	NA	Crustaceana	English	NA	NA	Scopus				
Fox S.; Foisy I.; De La Parra Venegas R.; Galván Pastoriza B.E.; Graham R.T.; Hoffmayer E.R.; Holmberg J.; Pierce S.J.	2013	Article	NA	Journal of Fish Biology	English	Fox S. Utila Whale Shark Research Utila Honduras; Foisy I. Utila Whale Shark Research Utila Honduras; De La Parra Venegas R. Chooj Ajauil AC Cancún Quintana Roo Mexico; Galván Pastoriza B.E. Chooj Ajauil AC Cancún Quintana Roo Mexico; Graham R.T. Wildlife Conservation Society Gulf and Caribbean Sharks and Rays Program Punta Gorda Belize; Hoffmayer E.R. National Marine Fisheries Service Southeast Fisheries Science Center Mississippi Laboratories Pascagoula MS 39567 United States; Holmberg J. ECOCEAN USA Portland OR 97217 1726 N. Terry Street United States; Pierce S.J. ECOCEAN USA Portland OR 97217 1726 N. Terry Street United States Marine Megafauna Foundation Tofo Beach Inhambane Mozambique	Utila Whale Shark Research Utila Honduras; Chooj Ajauil AC Cancún Quintana Roo Mexico; Wildlife Conservation Society Gulf and Caribbean Sharks and Rays Program Punta Gorda Belize; National Marine Fisheries Service Southeast Fisheries Science Center Mississippi Laboratories Pascagoula MS 39567 United States; ECOCEAN USA Portland OR 97217 1726 N. Terry Street United States; Marine Megafauna Foundation Tofo Beach Inhambane Mozambique	Scopus				
Hermosillo-Núñez B.B.; Ortiz M.; Rodríguez-Zaragoza F.A.	2019	Article	NA	Aquatic Conservation: Marine and Freshwater Ecosystems	English	Hermosillo-Núñez B.B. Laboratorio de Modelamiento de Sistemas Ecológicos Complejos (LAMSEC) Instituto Antofagasta Universidad de Antofagasta Antofagasta Chile Programa de Doctorado en Ciencias Aplicadas mención Sistemas Marinos Costeros Facultad de Ciencias del Mar & Recursos Biológicos Universidad de Antofagasta Antofagasta Chile; Ortiz M. Laboratorio de Modelamiento de Sistemas Ecológicos Complejos (LAMSEC) Instituto Antofagasta Universidad de Antofagasta Antofagasta Chile Instituto de Ciencias Naturales AvH Facultad de Ciencias del Mar y Recursos Biológicos Universidad de Antofagasta Antofagasta Chile; Rodríguez-Zaragoza F.A. Laboratorio de Ecología Molecular Microbiología y Taxonomía (LEMITAX) Departamento de Ecología Centro Universitario de Ciencias Biológicas y Agropecuarias Universidad de Guadalajara Guadalajara Jalisco Mexico	Laboratorio de Modelamiento de Sistemas Ecológicos Complejos (LAMSEC) Instituto Antofagasta Universidad de Antofagasta Antofagasta Chile; Programa de Doctorado en Ciencias Aplicadas mención Sistemas Marinos Costeros Facultad de Ciencias del Mar & Recursos Biológicos Universidad de Antofagasta Antofagasta Chile; Instituto de Ciencias Naturales AvH Facultad de Ciencias del Mar y Recursos Biológicos Universidad de Antofagasta Antofagasta Chile; Laboratorio de Ecología Molecular Microbiología y Taxonomía (LEMITAX) Departamento de Ecología Centro Universitario de Ciencias Biológicas y Agropecuarias Universidad de Guadalajara Guadalajara Jalisco Mexico	Scopus				
Gao K.; Chen J.-H.; Harris L.M.; Lin S.-J.; Xiang B.; Zhao M.	2017	Article	All Open Access; Bronze Open Access	Journal of Geophysical Research: Atmospheres	English	Gao K. Program in Atmospheric and Oceanic Sciences Princeton University Princeton NJ United States; Chen J.-H. NOAA/Geophysical Fluid Dynamics Laboratory Princeton NJ United States University Corporation for Atmospheric Research Boulder CO United States; Harris L.M. NOAA/Geophysical Fluid Dynamics Laboratory Princeton NJ United States; Lin S.-J. NOAA/Geophysical Fluid Dynamics Laboratory Princeton NJ United States; Xiang B. NOAA/Geophysical Fluid Dynamics Laboratory Princeton NJ United States University Corporation for Atmospheric Research Boulder CO United States; Zhao M. NOAA/Geophysical Fluid Dynamics Laboratory Princeton NJ United States	Program in Atmospheric and Oceanic Sciences Princeton University Princeton NJ United States; NOAA/Geophysical Fluid Dynamics Laboratory Princeton NJ United States; University Corporation for Atmospheric Research Boulder CO United States	Scopus				
Palacios Theil E.; Felder D.L.	2019	Article	NA	Marine Biology Research	English	Palacios Theil E. Department of Biology Laboratory for Crustacean Research University of Louisiana at Lafayette Lafayette LA United States; Felder D.L. Department of Biology Laboratory for Crustacean Research University of Louisiana at Lafayette Lafayette LA United States	Department of Biology Laboratory for Crustacean Research University of Louisiana at Lafayette Lafayette LA United States	Scopus				
Mendoza-González A.C.; Mateo-Cid L.E.; Searles R.B.	2007	Article	NA	Botanica Marina	English	Mendoza-González A.C. Laboratorio de Ficología Departamento de Botánica I. P. N. 11340 Mexico D.F. Prol. Carpio y Plan de Ayala Mexico; Mateo-Cid L.E. Laboratorio de Ficología Departamento de Botánica I. P. N. 11340 Mexico D.F. Prol. Carpio y Plan de Ayala Mexico; Searles R.B. Department of Biology Duke University Durham NC 27708-0338 United States	Laboratorio de Ficología Departamento de Botánica I. P. N. 11340 Mexico D.F. Prol. Carpio y Plan de Ayala Mexico; Department of Biology Duke University Durham NC 27708-0338 United States	Scopus				
Gasca R.	2009	Article	NA	Zoological Studies	English	Gasca R. El Colegio de la Frontera Sur (ECOSUR) Unidad Chetumal Chetumal Quintana Roo 77014 A.P. 424 Mexico	El Colegio de la Frontera Sur (ECOSUR) Unidad Chetumal Chetumal Quintana Roo 77014 A.P. 424 Mexico	Scopus				
Suca J.J.; Rasmuson L.K.; Malca E.; Gerard T.; Lamkin J.T.	2018	Article	All Open Access; Green Open Access	Fisheries Oceanography	English	Suca J.J. Cooperative Institute of Marine and Atmospheric Studies University of Miami Miami FL United States Biology Department Woods Hole Oceanographic Institution Woods Hole MA United States; Rasmuson L.K. Cooperative Institute of Marine and Atmospheric Studies University of Miami Miami FL United States Southeast Fisheries Science Center NOAA National Marine Fisheries Service Miami FL United States Marine Resources Program Oregon Department of Fish and Wildlife Newport OR United States; Malca E. Cooperative Institute of Marine and Atmospheric Studies University of Miami Miami FL United States Southeast Fisheries Science Center NOAA National Marine Fisheries Service Miami FL United States; Gerard T. Southeast Fisheries Science Center NOAA National Marine Fisheries Service Miami FL United States University of Phoenix South Florida Campus Miramar FL United States; Lamkin J.T. Southeast Fisheries Science Center NOAA National Marine Fisheries Service Miami FL United States	Cooperative Institute of Marine and Atmospheric Studies University of Miami Miami FL United States; Biology Department Woods Hole Oceanographic Institution Woods Hole MA United States; Southeast Fisheries Science Center NOAA National Marine Fisheries Service Miami FL United States; Marine Resources Program Oregon Department of Fish and Wildlife Newport OR United States; University of Phoenix South Florida Campus Miramar FL United States	Scopus				
Wang C.; Wang X.; Weisberg R.H.; Black M.L.	2017	Article	NA	Climate Dynamics	English	Wang C. State Key Laboratory of Tropical Oceanography South China Sea Institute of Oceanology Chinese Academy of Sciences Guangzhou China; Wang X. College of Oceanography Hohai University Nanjing China; Weisberg R.H. College of Marine Science University of South Florida St. Petersburg FL United States; Black M.L. NOAA/Atlantic Oceanographic and Meteorological Laboratory Miami FL United States	State Key Laboratory of Tropical Oceanography South China Sea Institute of Oceanology Chinese Academy of Sciences Guangzhou China; College of Oceanography Hohai University Nanjing China; College of Marine Science University of South Florida St. Petersburg FL United States; NOAA/Atlantic Oceanographic and Meteorological Laboratory Miami FL United States	Scopus				
